{"arch":"AMD64","bootstrap_digest":"bdd072cd00b8149d942fed2a7310fa717bb755b2b18570c066925202e8e4a399","entrypoints":{"illm":"C:\\Users\\iStar\\Documents\\ChatGPT\\illm\\out\\v01-final-rollback-r3\\local-only\\v00\\.illm\\envs\\rb00\\Scripts\\illm.exe"},"environment_id":"221767e3-91ed-4cdd-9b7f-6438bb20cf6d","environment_root":"C:\\Users\\iStar\\Documents\\ChatGPT\\illm\\out\\v01-final-rollback-r3\\local-only\\v00\\.illm\\envs\\rb00","finalized":true,"installed_packages":{"colorama":"0.4.6","illm":"0.0.0","iniconfig":"2.3.0","mypy":"1.18.2","mypy-extensions":"1.1.0","packaging":"26.3","pathspec":"1.1.1","pip":"26.2.1","pluggy":"1.6.0","pygments":"2.21.0","pytest":"9.1.1","setuptools":"83.0.0","typing-extensions":"4.16.0","wheel":"0.47.0"},"lock_digest":"19489d7dd52ec0f54bbd45b784add2453453523008ab46550dea8bf989cef274","manifest_digest":"da28c064792e1651f71bc781363138dfb0acc896a9c43e4af8742a6079f0b570","os":"Windows","profile":"rb00","project_root":"C:\\Users\\iStar\\Documents\\ChatGPT\\illm\\out\\v01-final-rollback-r3\\local-only\\v00","project_root_digest":"1ed0f463a78ce502efc3d2d25ecd2c5d79e697bb6672ace851ffa4ff76459b29","python_executable":"C:\\Users\\iStar\\Documents\\ChatGPT\\illm\\out\\v01-final-rollback-r3\\local-only\\v00\\.illm\\envs\\rb00\\Scripts\\python.exe","python_version":"3.12.14","schema_version":0}
