{"arch":"x86_64","bootstrap_digest":"bdd072cd00b8149d942fed2a7310fa717bb755b2b18570c066925202e8e4a399","entrypoints":{"illm":"/mnt/c/Users/iStar/Documents/ChatGPT/illm/.illm/envs/v00-release-linux/bin/illm"},"environment_id":"ca93c6cc-a6b4-4963-8529-3dbf12d05b09","environment_root":"/mnt/c/Users/iStar/Documents/ChatGPT/illm/.illm/envs/v00-release-linux","finalized":true,"installed_packages":{"colorama":"0.4.6","illm":"0.0.0","iniconfig":"2.3.0","mypy":"1.18.2","mypy-extensions":"1.1.0","packaging":"26.3","pathspec":"1.1.1","pip":"26.2.1","pluggy":"1.6.0","pygments":"2.21.0","pytest":"9.1.1","setuptools":"83.0.0","typing-extensions":"4.16.0","wheel":"0.47.0"},"lock_digest":"19489d7dd52ec0f54bbd45b784add2453453523008ab46550dea8bf989cef274","manifest_digest":"f6d7e9b3a3f73db46c03449706847e045a8c0ade8820f0d85168b82b6e3a6c18","os":"Linux","profile":"v00-release-linux","project_root":"/mnt/c/Users/iStar/Documents/ChatGPT/illm","project_root_digest":"1ed0f463a78ce502efc3d2d25ecd2c5d79e697bb6672ace851ffa4ff76459b29","python_executable":"/mnt/c/Users/iStar/Documents/ChatGPT/illm/.illm/envs/v00-release-linux/bin/python","python_version":"3.12.3","schema_version":0}
