{"arch":"AMD64","bootstrap_digest":"bdd072cd00b8149d942fed2a7310fa717bb755b2b18570c066925202e8e4a399","entrypoints":{"illm":"C:\\Users\\iStar\\Documents\\ChatGPT\\illm\\.illm\\envs\\dev\\Scripts\\illm.exe"},"environment_id":"239318a0-a7a1-48f2-8025-517130e15eb4","environment_root":"C:\\Users\\iStar\\Documents\\ChatGPT\\illm\\.illm\\envs\\dev","finalized":true,"installed_packages":{"colorama":"0.4.6","illm":"0.0.0","iniconfig":"2.3.0","mypy":"1.18.2","mypy-extensions":"1.1.0","packaging":"26.3","pathspec":"1.1.1","pip":"26.2.1","pluggy":"1.6.0","pygments":"2.21.0","pytest":"9.1.1","setuptools":"83.0.0","typing-extensions":"4.16.0","wheel":"0.47.0"},"lock_digest":"19489d7dd52ec0f54bbd45b784add2453453523008ab46550dea8bf989cef274","manifest_digest":"f189b4d5b894b87ad82d085904ed2f625b7f40ffb57803cfade495b5963cd81e","os":"Windows","profile":"dev","project_root":"C:\\Users\\iStar\\Documents\\ChatGPT\\illm","project_root_digest":"34588fdec96e54ce1d822c421ecf66d7af9b7a79a05e03238e6ca47f4f1db612","python_executable":"C:\\Users\\iStar\\Documents\\ChatGPT\\illm\\.illm\\envs\\dev\\Scripts\\python.exe","python_version":"3.14.7","schema_version":0}
